Brandname,Productname,Colors,Sizes,Description,Materials,Maintenance,RegularPrice,CurrentPrice
s.Oliver RED LABEL,Slip-On Sneaker mit Logo-Stickerei,Mittelgrau|Rosé|Bleu,36|37|38|39|40|41|42,"Damen Slip-On Sneaker von s.Oliver|Canvas|Gummisohle|Abgerundete Spitze mit Vorderkappe|Zierösen|Logo-Stickerei|Sohlenhöhe: 2,5 cm|Farbe Rosé|Artikelnummer 9634809",Hauptmaterial 1: 100% Canvas,,39.95,39.95
Keds,Sneaker aus Leder,Weiß,"37,5|7|38|7,5|39|8|39,5|8,5|40|9|40,5|9,5|41|10",Damen Sneaker von Keds|Echtes Leder|Lochmuster|Schnürverschluss|Ortholite®-Fußbett|Gummisohle|Sohlenhöhe: 2 cm|Farbe Weiß|Artikelnummer 9641288,Hauptmaterial 1: 100% Leder|Futter 1: 100% Textil|Sohle: 100% Gummi,,74.95,74.95
MICHAEL Michael Kors,Slip-On Sneaker aus Leder im Ethno-Look,Schwarz,"37|7|38|7,5|38,5|8|39|8,5|40|9|40,5|9,5|41|10",Damen Slip-On Sneaker von MICHAEL Michael Kors|Modell Leo|Echtes Leder |Kontrastbesatz aus Textil|Abgerundete Spitze|Elastische Einsätze an den Seiten|Besatz im Ethno-Look|Profilsohle aus Gummi|Sohlenhöhe: 3 cm|Farbe Schwarz|Artikelnummer 9582378,Hauptmaterial 1: 100% Leder|Hauptmaterial 2: 100% Textil|Sohle: 100% Gummi,,149.95,149.95
MICHAEL Michael Kors,Slip-On Sneaker aus Leder im Ethno-Look,Schwarz,"37|7|38|7,5|38,5|8|39|8,5|40|9|40,5|9,5|41|10",Damen Slip-On Sneaker von MICHAEL Michael Kors|Modell Leo|Echtes Leder |Kontrastbesatz aus Textil|Abgerundete Spitze|Elastische Einsätze an den Seiten|Besatz im Ethno-Look|Profilsohle aus Gummi|Sohlenhöhe: 3 cm|Farbe Schwarz|Artikelnummer 9582378,Hauptmaterial 1: 100% Leder|Hauptmaterial 2: 100% Textil|Sohle: 100% Gummi,,149.95,149.95
Maypol,Espadrilles aus Leder mit floralen Stickereien,Schwarz|Offwhite,36|37|38|39|40|41|42,"Damen Espadrilles von Maypol|Echtes Leder|Abgerundete Spitze|Florale Stickereien|Gummisohle mit Kontrastbesatz in Flechtoptik|Handmade in Spain|Sohlenhöhe: 1,5 cm|Farbe Offwhite|Artikelnummer 9641305",Hauptmaterial 1: 100% Leder|Futter 1: 100% Leder|Sohle: 100% Gummi,,99.95,99.95
Tamaris,Sandalen aus Leder in Metallicoptik,Rosé,36|37|38|39|40|41|42,Damen Sandalen von Tamaris|Echtes Leder|Metallicoptik|Riemen |Leicht elastischer Fersenriemen|Gummisohle|Sohlenhöhe: 1 cm|Farbe Rosé|Artikelnummer 9641318,Hauptmaterial 1: 100% Leder|Sohle: 100% Gummi,,29.95,29.95
MICHAEL Michael Kors,Espadrilles aus Leder mit floralen Applikationen,Weiß|Jeans,"37|7|38|7,5|38,5|8|39|8,5|40|9|40,5|9,5|41|10",Damen Espadrilles von MICHAEL Michael Kors|Modell Lola|Echtes Leder |Abgerundete Spitze |Florale Applikationen mit Logo-Prägung|Flechtsohle mit Gummibesatz|Sohlenhöhe: 1 cm|Farbe Jeans|Artikelnummer 9582370,Hauptmaterial 1: 100% Leder|Sohle: 100% Gummi,,129.95,129.95
Tamaris,Sneaker mit Besatz in Metallicoptik,Taupe,36|37|38|39|40|41|42,Damen Sneaker von Tamaris|Textil in Lederoptik|Besatz in Metallicoptik|Muster mit Metallic-Details|Schnürverschluss|Gummisohle|Sohlenhöhe: 2 cm|Farbe Taupe|Artikelnummer 9634200,"Hauptmaterial 1: 50% Textil, 50% Synthetik|Futter 1: 100% Synthetik|Futter 2: 100% Textil|Sohle: 100% Gummi",,59.95,59.95
Espadrij,Espadrilles aus Canvas,Dunkelblau|Rosé|Schilf,36|37|38|39|40|41|42,Damen Espadrilles von Espadrij l'originale®|Canvas|Kontrastnähte|Logo-Fähnchen|Flache Gummisohle mit Besatz in Flechtoptik|Made in France|Sohlenhöhe: 2 cm|Farbe Rosé|Artikelnummer 9636993,Hauptmaterial 1: 100% Textil|Futter 1: 100% Textil|Sohle: 100% Gummi,,34.95,34.95
Keds,Sneaker aus Canvas,Sand,"37,5|7|38|7,5|39|8|39,5|8,5|40|9|40,5|9,5|41|10","Damen Sneaker von Keds|Canvas|Karomuster in Metallicoptik|Schnürverschluss|Gummisohle|Sohlenhöhe: 1,5 cm|Farbe Sand|Artikelnummer 9641286",Hauptmaterial 1: 100% Textil|Futter 1: 100% Textil|Sohle: 100% Gummi,,69.95,69.95
ILC,Espadrilles aus Veloursleder,Hellgrau|Altrosa,36|37|38|39|40|41|42,"Damen Espadrilles von ILC|Echtes Veloursleder|Zehenkappe in Metallicoptik|Gepolsterte Innensohle|Gummisohle mit Besatz in Flechtoptik|Handmade in Spain|Sohlenhöhe: 1,5 cm|Farbe Hellgrau|Artikelnummer 9648366",Hauptmaterial 1: 100% Leder|Futter 1: 100% Textil|Sohle: 100% Gummi,,59.95,59.95
Hilfiger Denim,Zehentrenner aus Leder,Schwarz|Cognac ,36|37|38|39|40|41|42,Damen Zehentrenner von Hilfiger Denim|Echtes Leder|Detail in Lacklederoptik|Riemenverschluss|Gummisohle|Sohlenhöhe: 1 cm|Farbe Cognac |Artikelnummer 9582211,Hauptmaterial 1: 100% Leder|Hauptmaterial 2: 100% Polyurethan|Futter 1: 100% Polyester|Sohle: 100% Gummi,,69.95,69.95
Weekend Max Mara,Sandalen im Ethno-Look mit Lederdetails,Pseudo,36|37|38|39|40|41,"Damen Sandalen von Weekend Max Mara|Modell Athos|Textil mit Lederdetails|Abgerundete Spitze|Grafisches Muster|Fransenbesatz |Pompon-Besatz|Riemenverschluss|Gummisohle mit Kontrastbesatz in Flechtoptik|Sohlenhöhe: 1,5 cm|Farbe Pseudo|Artikelnummer 9607986",Hauptmaterial 1: 100% Leder|Hauptmaterial 2: 100% Textil|Futter 1: 100% Leder|Sohle: 100% Gummi,,169.95,169.95
Birkenstock,Boots aus Lammshearling,Schwarz,36|37|38|40|41|42,"Damen Boots von Birkenstock|Lammshearling|Modell Westford|Mittelhoher Schaft|Verstellbarer Riegel mit Dornschließe|Reißverschluss auf der Innenseite|Weiches Fellfutter|Profilsohle|Sohlenhöhe: 2,4 cm|Farbe Schwarz|Artikelnummer 9301559",Hauptmaterial 1: 100% Lammshearling|Futter 1: 100% Leder|Futter 2: 100% Kork|Sohle: 100% Ethylenvinylacetat,,169.95,169.95
ASH,Stiefelette aus echtem Veloursleder,Taupe,36|37|38|39|40|41,"Damen Stiefelette von ASH|Modell Heidi|Echtes Veloursleder|Überknöchelhoher Schaft|Reißverschluss|Vorne spitz zulaufend|Kubanischer Absatz|Sohle aus Leder|Stickereien|Ziernieten|Absatzhöhe: 5,5 cm|Schafthöhe: 11 cm|Schaftweite: 26 cm|Farbe Taupe|Artikelnummer 9634146",Hauptmaterial 1: 100% Leder|Futter 1: 100% Leder|Sohle: 100% Leder, Nicht waschen| Nicht bleichen| Kein Trockner| Nicht bügeln| Keine chemische Reinigung,199.95,199.95
Pepe Jeans,Sneaker mit Glitter-Effekt,Gold,36|37|38|39|40|41,Damen Sneaker von Pepe Jeans|Modell Verona W Glitter|Lederoptik|Details in Metallicoptik|Kontrasteinsatz aus Mesh|Beschichtung mit Glitter-Effekt|Schnürverschluss|Gummisohle|Sohlenhöhe: 2 cm|Farbe Gold|Artikelnummer 9635549,Hauptmaterial 1: 100% Synthetik|Futter 1: 100% Textil|Sohle: 100% Gummi,,75.95,75.95
Guess,Sneaker in Metallicoptik,Silber,36|37|38|39|40|41,Damen Sneaker von GUESS|Strapazierfähiges Material|Metallicoptik|Abgerundete Spitze|Schnürverschluss|Gummisohle|Logo-Aufnäher|Inklusive eines weiteren Paares Schnürsenkel|Sohlenhöhe: 3 cm|Farbe Silber|Artikelnummer 9630044,,,85.95,85.95
Castañer,Wedges aus Veloursleder mit Keilabsatz,Fuchsia|Blau,36|37|38|39|40|41,Damen Wedges von Castañer|Modell Carina 6|Echtes Veloursleder|Schnürverschluss mit Pompon-Abschlüssen|Keilabsatz mit Besatz in Flechtoptik|Gummisohle mit Besatz in Flechtoptik|Absatzhöhe: 7 cm|Farbe Blau|Artikelnummer 9634784,Hauptmaterial 1: 100% Veloursleder|Besatz 1: 100% Textil|Sohle: 100% Gummi,,125.95,125.95
Moon Boot,Moonboots mit Effektgarn,Mittelgrau,37|38|39|40|41|42,"Damen Moonboots von Moon Boot ®|Effektgarn|Webpelzfutter|Gummisohle|Abgerundete Spitze|Überknöchelhoher Schaft|Schnürverschluss|Sohlenhöhe: 2,5 cm|Farbe Mittelgrau|Artikelnummer 9654241",Hauptmaterial 1: 100% Synthetik|Futter 1: 100% Textil|Sohle: 100% Gummi,,159.95,99.95
Hilfiger Denim,Booties aus echtem Veloursleder,Mittelbraun,37|38|39|40|41|42,"Damen Booties von Hilfiger Denim|Echtes Veloursleder|Spitz zulaufende Form|Überknöchelhoher Schaft|Reißverschluss|Zierriemen|Kleines Logo an der Ferse|Gummisohle|Sohlenhöhe: 2,5 cm|Farbe Mittelbraun|Artikelnummer 9509786",Hauptmaterial 1: 100% Leder|Futter 1: 100% Leder|Sohle: 100% Gummi,,139.95,99.95
Guess,Ankle Boots aus Veloursleder mit Plateausohle,Olivgrün,36|37|38|39|40|41,Damen Ankle Boots von GUESS|Echtes Veloursleder|Knöchelhoher Schaft|Elastischer Einsatz und Lasche am Schaft|Spitz zulaufende Form|Plateausohle mit Profil|Blockabsatz|Logo-Applikation an der Ferse|Sohlenhöhe: 3 cm|Absatzhöhe: 12 cm|Farbe Olivgrün|Artikelnummer 9522662,Hauptmaterial 1: 100% Leder|Hauptmaterial 2: 100% Textil|Futter 1: 100% Synthetik|Futter 2: 100% Leder|Futter 3: 100% Textil|Sohle: 100% Synthetik, Nicht waschen| Nicht bleichen| Kein Trockner| Nicht bügeln| Keine chemische Reinigung,175.95,129.95
Tommy Hilfiger,Pantolette aus Veloursleder mit Keilabsatz,Dunkelblau|Cognac ,36|37|38|39|40|41,Damen Pantolette von Tommy Hilfiger |Echtes Veloursleder|Gekreuzte Riemen mit Logo-Applikation|Fußbett aus Leder|Keilabsatz aus Kork|Gummisohle |Absatzhöhe: 6 cm|Farbe Dunkelblau|Artikelnummer 9591608,Hauptmaterial 1: 100% Veloursleder|Futter 1: 100% Leder|Sohle: 100% Gummi,,119.95,119.95
Guess,Sandalette aus Veloursleder mit Pfennigabsatz,Fuchsia|Schwarz,36|37|38|39|40|41,"Damen Sandalette von GUESS|Echtes Veloursleder|Riemen mit transparenten Einsätzen|Riemenverschluss|Logo-Applikation an der Ferse|Pfennigabsatz|Gummisohle|Absatzhöhe: 8,5 cm|Farbe Fuchsia|Artikelnummer 9636285",Hauptmaterial 1: 100% Veloursleder|Hauptmaterial 2: 100% Synthetik|Sohle: 100% Gummi,,145.95,145.95
s.Oliver RED LABEL,Sandalette mit Pfennigabsatz,Schwarz,36|37|38|39|40|41,Damen Sandalette von s.Oliver PREMIUM|Velourslederoptik|Riemen|Fesselriemen|Reißverschluss an der Ferse|Soft Foam Innensohle|Gummisohle|Pfennigabsatz|Absatzhöhe: 8 cm|Farbe Schwarz|Artikelnummer 9634189,Hauptmaterial 1: 100% Textil|Futter 1: 100% Synthetik|Sohle: 100% Gummi,,59.95,59.95
Guess,Sneaker mit Zehenkappe in Metallicoptik,Weiß,36|37|38|39|40|41,"Damen Sneaker von GUESS|Strapazierfähiges Material|Abgerundete Spitze|Schnürverschluss|Zehenkappe in Metallicoptik|Sohle aus Gummi|Logo-Prints|Sohlenhöhe: 2,5 cm|Farbe Weiß|Artikelnummer 9630052",,,85.95,85.95
Marc O'Polo,Sneaker aus Veloursleder mit Logo-Stickereien,Bleu|Schlamm,36|37|38|39|40|41,Damen Sneaker von MARC O'POLO|Echtes Veloursleder mit Besatz aus Textil|Schnürverschluss|Logo-Stickereien|Profilsohle aus Gummi|Sohlenhöhe: 2 cm|Farbe Schlamm|Artikelnummer 9606553,Hauptmaterial 1: 100% Veloursleder|Hauptmaterial 2: 100% Nylon,,109.95,109.95
Guess,High Heels in Denimoptik mit Nietenbesatz,Jeans,36|37|38|39|40|41,Damen High Heels von GUESS|Textil in Denimoptik|Spitz zulaufend|Nietenbesatz|Gummisohle|High Heels|Absatzhöhe: 10 cm|Farbe Jeans|Artikelnummer 9630037,Hauptmaterial 1: 100% Textil|Sohle: 100% Gummi,,135.95,135.95
Apple of Eden,Sandalen aus Leder in Denimoptik,Jeans,36|37|38|39|40|41,Damen Sandalen von Apple of Eden|Echtes Leder in Denimoptik|Schnürung mit Zierquasten|Innensohle aus Leder|Gummisohle|Sohlenhöhe: 1 cm|Farbe Jeans|Artikelnummer 9637433,Hauptmaterial 1: 100% Leder|Futter 1: 100% Leder|Sohle: 100% Gummi,,79.95,79.95
Selected Femme,Espadrilles aus Leder,Schwarz|Rosé,36|37|38|39|40|41,"Damen Espadrilles von SELECTED FEMME|Modell Marley|Leder in Straußenlederoptik|Gummisohle|Abgerundete Spitze|Einsatz in Flechtoptik|Sohlenhöhe: 2,5 cm|Farbe Schwarz|Artikelnummer 9632664",Hauptmaterial 1: 100% Leder,,69.95,69.95
Nike,Sneaker 'Juvenate' mit Meshbesatz,Rosa|Olivgrün,"36|5,5|37,5|6,5|38|7|39|8|39,5|8,5|41|9,5",Damen Sneaker von NIKE|Modell Juvenate|Leichtes Material|Gummisohle|Abgerundete Spitze|Schnürverschluss|Meshbesatz|Logo-Prints|Sohlenhöhe: 3 cm|Farbe Olivgrün|Artikelnummer 9657038,,,94.95,94.95
Coast,Pumps mit perforierten Details,Schwarz,36|3|37|4|38|5|39|6|40|7|41|8,"Damen Pumps von Coast|Velourslederoptik|Einsatz aus Mesh |Perforierte Details|Vorne spitz zulaufend|Seitliche Aussparung|Pfennigabsatz|Absatzhöhe: 8,5 cm|Farbe Schwarz|Artikelnummer 9695940",Hauptmaterial 1: 100% Textil|Sohle: 100% Gummi,,79.95,79.95
Apple of Eden,Derby aus echtem Leder mit Schnürung,Schwarz|Weiß,36|37|38|39|40|41,"Damen Derby von Apple of Eden|Echtes Leder|Modell Holly|Schnürverschluss|Abgerundete Spitze|Derbybogen|Profilsohle|Sohlenhöhe: 2,5 cm|Farbe Weiß|Artikelnummer 9455065","Hauptmaterial 1: 100% Leder|Futter 1: 50% Textil, 50% Leder|Sohle: 100% Synthetik",,89.95,89.95
Castañer,Sandalette aus Veloursleder mit Plateausohle ,Schwarz,36|37|38|39|40|41,"Damen Sandalette von Castañer|Modell Ana|Echtes Veloursleder|Perforierte Details am Riemen|Riemenverschluss|Plateausohle aus Gummi mit Besatz in Flechtoptik|Sohlenhöhe: 3,5 cm|Farbe Schwarz|Artikelnummer 9634788",Hauptmaterial 1: 100% Veloursleder|Sohle: 100% Gummi,,185.95,185.95
ILC,Espadrilles mit Blumen-Stickereien,Beige|Rot,36|38|39|40|41|42,Damen Espadrilles von ILC|Textil mit Blumen-Stickereien|Abgerundete Spitze |Zierquasten|Gepolsterte Innensohle|Gummisohle mit Besatz in Flechtoptik|Handmade in Spain|Sohlenhöhe: 2 cm|Farbe Rot|Artikelnummer 9648383,Hauptmaterial 1: 100% Textil|Futter 1: 100% Textil|Sohle: 100% Gummi,,69.95,69.95
Pepe Jeans,Sneaker aus Canvas mit Logo-Stickerei,Marineblau|Weiß|Schwarz,36|37|38|39|40|41,Damen Sneaker von Pepe Jeans |Modell Aberlady Basic|Canvas|Abgerundete Spitze |Schnürverschluss|Logo-Stickerei an der Seite |Logo-Applikation|Ortholite® Innensohle|Profilsohle aus Gummi|Sohlenhöhe: 2 cm|Farbe Schwarz|Artikelnummer 9635555,Hauptmaterial 1: 100% Textil|Sohle: 100% Gummi,,49.95,49.95
Tommy Hilfiger,Espadrilles aus Canvas mit Details in Flechtoptik,Dunkelblau|Beige,36|37|38|39|40|41,Damen Espadrilles von Tommy Hilfiger |Canvas |Details in Flechtoptik|Abgerundete Spitze|Elastische Einsätze an den Seiten|Logo-Stickerei|Gummisohle mit Kontrastbesatz in Flechtoptik|Sohlenhöhe: 1 cm|Farbe Dunkelblau|Artikelnummer 9591604,Hauptmaterial 1: 100% Textil|Sohle: 100% Gummi,,59.95,59.95
Castañer,Wedges aus Veloursleder mit Plateausohle,Schwarz|Altrosa,36|37|38|39|40|41,"Damen Wedges von Castañer|Modell Caterina|Echtes Veloursleder|Perforierte Details|Riemenverschluss|Keilabsatz|Plateausohle aus Gummi mit Besatz in Flechtoptik|Absatzhöhe: 9,5 cm|Sohlenhöhe: 3 cm|Farbe Schwarz|Artikelnummer 9634789",Hauptmaterial 1: 100% Veloursleder|Sohle: 100% Gummi,,195.95,195.95
Tommy Hilfiger,Chelsea Boots aus Gummi,Gelb|Marineblau,36|37|38|39|40|41,Damen Chelsea Boots von Tommy Hilfiger|PVC|Gummisohle|Abgerundete Spitze|Überknöchelhoher Schaft|Elastischer Einsatz|Sohlenhöhe: 3 cm|Farbe Gelb|Artikelnummer 9552756,Hauptmaterial 1: 100% Textil|Hauptmaterial 2: 100% PVC|Futter 1: 100% Textil|Sohle: 100% Gummi,,79.95,79.95
ASH,Sneaker mit Plateausohle,Silber,36|37|38|39|40|41,"Damen Sneaker von ASH|Modell Cult|Echtes Leder|Metallicoptik|Abgerundete Spitze |Schnürverschluss|Plateausohle aus Gummi|Kontrastbesatz an der Ferse|Logo-Prägung|Sohlenhöhe: 5,5 cm|Farbe Silber|Artikelnummer 9634143",Hauptmaterial 1: 100% Leder|Futter 1: 100% Textil|Futter 2: 100% Leder|Sohle: 100% Gummi, Nicht waschen| Nicht bleichen| Kein Trockner| Nicht bügeln| Keine chemische Reinigung,175.95,175.95
INUIKKII,Lederboots mit Textilbesatz,Dunkelblau,37|38|39|40|41|42,Damen Lederboots von INUIKII|Leder|Fellfutter|Gummisohle|Abgerundete Spitze|Überknöchelhoher Schaft|Textilbesatz mit Glitter-Effekt|Schnürverschluss mit Kettendetail und Zierquasten|Handgefertigt in der Schweiz|Sohlenhöhe: 2 cm|Farbe Dunkelblau|Artikelnummer 9601768,"Hauptmaterial 1: 100% Leder, 100% Textil|Sohle: 100% Gummi",,349.0,199.95
Aigle,Gummistiefel mit Zierstreifen,Gelb,36|37|38|39|40|41,Damen Gummistiefel von Aigle|Mattes Gummi|Innenseite aus Textil|Zierstreifen|Logo|Gummisohle|Wadenhoher Schaft|Sohlenhöhe: 2 cm|Schafthöhe: 26 cm|Schaftweite: 36 cm|Farbe Gelb|Artikelnummer 9483403,Hauptmaterial 1: 100% Gummi|Futter 1: 100% Textil|Sohle: 100% Gummi,,59.95,59.95
Tamaris,Pumps aus Veloursleder mit Kontrastbesatz,Mittelgrau|Dunkelblau,36|37|38|39|40|41,"Damen Pumps von Tamaris|Echtes Veloursleder|Vorne spitz zulaufend|Glänzender Kontrastbesatz in Kroko-Optik|Pfennigabsatz|Gummisohle|Absatzhöhe: 7,5 cm|Farbe Dunkelblau|Artikelnummer 9634196",Hauptmaterial 1: 100% Veloursleder|Besatz 1: 100% Gummi|Sohle: 100% Gummi,,59.95,59.95
Armani Jeans,Sneaker aus Leder mit Kontrasteinsatz,Silber|Gold,36|37|38|39|40|41,Damen Sneaker von Armani Jeans|Echtes Leder mit Kontrasteinsatz aus Textil|Abgerundete Spitze |Schnürverschluss|Details in Metallicoptik|Logo-Applikation|Gummisohle|Sohlenhöhe: 3 cm|Farbe Gold|Artikelnummer 9571391,"Hauptmaterial 1: 100% Leder, 100% Textil|Sohle: 100% Gummi",,179.95,179.95
Guess,Sneaker aus Leder mit Glitter-Effekt,Beige|Schwarz,36|37|38|39|40|41,"Damen Sneaker von GUESS|Echtes Leder|Abgerundete Spitze |Schnürverschluss|Details in Metallicoptik|Punktedetails |Glitter-Effekt|Logo-Applikation|Profilsohle aus Gummi|Sohlenhöhe: 2,5 cm|Farbe Schwarz|Artikelnummer 9630048",Hauptmaterial 1: 100% Leder|Sohle: 100% Gummi,,115.95,115.95
Selected Femme,Stiefelette aus echtem Leder,Schwarz,36|37|38|39|40|41,"Damen Stiefelette von SELECTED FEMME|Echtes Leder|Spitz zulaufend|Überknöchelhoher Schaft|Elastischer Einsatz |Innensohle aus Leder|Keilabsatz |Made in Europe|Absatzhöhe: 6,5 cm |Farbe Schwarz|Artikelnummer 9632657",Hauptmaterial 1: 100% Leder|Futter 1: 100% Leder|Sohle: 100% Kunststoff,,139.95,139.95
MICHAEL Michael Kors,Wedges aus Leder mit floralen Applikationen,Weiß,"37|7|38,5|8|39|8,5|40|9|40,5|9,5|41|10",Damen Wedges von MICHAEL Michael Kors|Modell Heidi|Echtes Leder|Riemen mit floralen Applikationen|T-Riemen|Riemchenverschluss|Plateausohle in Flechtoptik|Keilabsatz|Sohlenhöhe: 4 cm|Absatzhöhe: 12 cm|Farbe Weiß|Artikelnummer 9582363,Hauptmaterial 1: 100% Leder|Futter 1: 100% Leder|Sohle: 100% Synthetik,,185.95,185.95
Pepe Jeans,Sneaker in Metallicoptik,Silber,36|37|38|39|40|41,"Damen Sneaker von Pepe Jeans|Modell Aberlady Metal|Canvas|Beschichtung in Metallicoptik|Ziernähte|Schnürverschluss|Gummisohle|Sohlenhöhe: 2,5 cm|Farbe Silber|Artikelnummer 9635552",Hauptmaterial 1: 100% Textil|Futter 1: 100% Textil|Sohle: 100% Gummi,,59.95,59.95
Lauren Ralph Lauren,Sneaker aus Canvas,Dunkelblau|Weiß,"36|5,5|37|6,5|38|7|39|8|40|8,5|41|9,5",Damen Sneaker von Lauren Ralph Lauren|Modell Jolie|Canvas|Schnürverschluss|Logo-Stickerei|Gummisohle|Sohlenhöhe: 3 cm|Farbe Dunkelblau|Artikelnummer 9578775,Hauptmaterial 1: 100% Textil|Futter 1: 100% Textil|Sohle: 100% Gummi,,69.95,69.95
Tamaris,Pantolette aus Leder in Metallicoptik,Silber,36|37|38|39|40|41,"Damen Pantolette von Tamaris|Echtes Leder|Metallicoptik|Spitz zulaufend|Niedriger Blockabsatz|Gummisohle|Absatzhöhe: 2,5 cm|Farbe Silber|Artikelnummer 9641317",Hauptmaterial 1: 100% Leder|Futter 1: 100% Leder|Sohle: 100% Gummi,,49.95,49.95
ASH,Sneaker mit Plateausohle,Weiß,36|37|38|39|40|41,Damen Sneaker von ASH|Modell Cult|Leder|Plateausohle aus Gummi|Abgerundete Spitze|Schnürverschluss|Kontrastbesatz|Plateauhöhe: 5 cm|Farbe Weiß|Artikelnummer 9634144,Hauptmaterial 1: 100% Leder|Futter 1: 100% Textil|Futter 2: 100% Leder|Sohle: 100% Gummi,,169.95,169.95
Birkenstock,Sandalen mit Glitter-Effekt,Silber,36|37|38|39|40|41,Damen Sandalen von BIRKENSTOCK|Modell Madrid|Birko-Flor|Schmale Passform |Verstellbarer Riemen mit Glitter-Effekt|Innensohle aus Leder|Ergonomisches Fußbett aus Naturkork|EVA-Sohle mit Profil|Made in Germany|Sohlenhöhe: 1 cm |Farbe Silber|Artikelnummer 9643037,"Hauptmaterial 1: 100% Birko-Flor|Futter 1: 100% Leder, 100% Kork|Sohle: 100% Ethylenvinylacetat",,54.95,54.95
Selected Femme,Sneaker 'Donna' aus Veloursleder,Mittelgrau|Rosé,36|37|38|39|40|41,"Damen Sneaker von SELECTED FEMME|Modell Donna|Echtes Veloursleder|Abgerundete Spitze|Schnürverschluss|Perforierte Details im Fersenbereich|Fußbett aus Leder|Gummisohle|Sohlenhöhe: 2,5 cm|Farbe Mittelgrau|Artikelnummer 9632662",Hauptmaterial 1: 100% Veloursleder|Futter 1: 100% Leder|Sohle: 100% Gummi,,99.95,99.95
Lauren Ralph Lauren,Zehentrenner aus Leder mit Logo-Applikation,Schwarz|Rosé,"36|5,5|37|6,5|38|7|39|8|40|8,5|41|9,5",Damen Zehentrenner von Lauren Ralph Lauren|Modell Aimon|Echtes Leder |Riemen mit Logo-Applikation|Gummisohle |Dornschließe|Sohlenhöhe: 1 cm|Farbe Schwarz|Artikelnummer 9578770,Hauptmaterial 1: 100% Leder|Sohle: 100% Gummi,,79.95,79.95
Tamaris,Stiefel mit Stretch-Anteil ,Schwarz,36|37|38|39|40|41,Damen Stiefel von Tamaris|Leichtes Material mit Stretch-Anteil |Abgerundete Spitze|Schmale Sohle |Absatz |Schaft aus elastischem Material|Reißverschlüsse an den Innenseiten|Schafthöhe: 40 cm|Schaftweite: 30 cm|Absatzhöhe: 7 cm|Farbe Schwarz|Artikelnummer 9540175,Hauptmaterial 1: 100% Synthetik|Sohle: 100% Gummi,,59.95,59.95
MARC CAIN BAGS & SHOES,Sneaker aus echtem Leder,Schwarz|Weiß,36|1|37|2|38|3|39|4|40|5|41|6,Damen Sneaker von Marc Cain Bags & Shoes|Echtes Leder|Gummisohle|Abgerundete Spitze|Schnürverschluss aus Satin|Zierperlenbesatz an der Lasche|Perforiertes Logo-Muster|Sohlenhöhe: 3 cm|Farbe Schwarz|Artikelnummer 9582059,Hauptmaterial 1: 100% Leder|Futter 1: 100% Leder|Sohle: 100% Gummi,,249.0,249.0
ASH,Sandalette aus Leder,Dunkelbraun,36|37|38|39|40|41,"Damen Sandalette von ASH|Modell Avalon|Riemen aus Leder|Nieten-, Zierstein- und Zierperlenbesatz|Reißverschluss auf der Rückseite|Innensohle aus Leder|Ledersohle|Hoher Absatz|Absatzhöhe: 9,5 cm|Farbe Dunkelbraun|Artikelnummer 9642815",Hauptmaterial 1: 100% Leder|Futter 1: 100% Leder|Sohle: 100% Leder,,235.0,235.0
Lauren Ralph Lauren,Sneaker aus Leder in Metallicoptik,Gold,"36|5,5|37|6,5|38|7|39|8|40|8,5|41|9,5","Damen Sneaker von Lauren Ralph Lauren|Leder in Metallicoptik|Abgerundete Spitze|Schnürverschluss|Logo-Applikationen|Details aus Gummi|Profilsohle aus Gummi|Sohlenhöhe: 2,5 cm|Farbe Gold|Artikelnummer 9578780","Hauptmaterial 1: 88% Ziegenleder, 12% Synthetik|Futter 1: 80% Textil, 11% Synthetik, 9% Leder",,99.95,99.95
Marc O'Polo,Espadrilles aus Canvas mit Plateausohle,Offwhite,36|37|38|39|40|41,Damen Espadrilles von MARC O’POLO|Canvas|Abgerundete Spitze|Schnürverschluss|Plateausohle aus Gummi mit Besatz in Flechtoptik|Sohlenhöhe: 4 cm|Farbe Offwhite|Artikelnummer 9606559,"Hauptmaterial 1: 100% Textil|Hauptmaterial 2: 100% Leder|Futter 1: 100% Textil, 100% Leder|Sohle: 100% Gummi",,89.95,89.95
MICHAEL Michael Kors,Wedges aus Leder mit floralen Applikationen,Weiß,"37|7|38,5|8|39|8,5|40|9|40,5|9,5|41|10",Damen Wedges von MICHAEL Michael Kors|Modell Heidi|Echtes Leder|Riemen mit floralen Applikationen|T-Riemen|Riemchenverschluss|Plateausohle in Flechtoptik|Keilabsatz|Sohlenhöhe: 4 cm|Absatzhöhe: 12 cm|Farbe Weiß|Artikelnummer 9582363,Hauptmaterial 1: 100% Leder|Futter 1: 100% Leder|Sohle: 100% Synthetik,,185.95,185.95
Selected Femme,Stiefelette aus echtem Leder,Schwarz,36|37|38|39|40|41,"Damen Stiefelette von SELECTED FEMME|Echtes Leder|Spitz zulaufend|Überknöchelhoher Schaft|Elastischer Einsatz |Innensohle aus Leder|Keilabsatz |Made in Europe|Absatzhöhe: 6,5 cm |Farbe Schwarz|Artikelnummer 9632657",Hauptmaterial 1: 100% Leder|Futter 1: 100% Leder|Sohle: 100% Kunststoff,,139.95,139.95
Armani Jeans,Sneaker in Metallicoptik,Silber,36|37|38|39|40|41,"Damen Sneaker von Armani Jeans|Strapazierfähiges Material|Metallicoptik|Kontrasteinsätze aus Mesh|Abgerundete Spitze|Schnürverschluss|Logo-Applikationen|Profilsohle aus Gummi|Sohlenhöhe: 2,5 cm|Farbe Silber|Artikelnummer 9571454",Hauptmaterial 1: 100% Synthetik|Sohle: 100% Gummi,,149.95,149.95
Selected Femme,Espadrilles aus Leder,Schwarz|Rosé,36|37|38|39|40|41,"Damen Espadrilles von SELECTED FEMME|Modell Marley|Leder in Straußenlederoptik|Gummisohle|Abgerundete Spitze|Einsatz in Flechtoptik|Sohlenhöhe: 2,5 cm|Farbe Rosé|Artikelnummer 9632665",Hauptmaterial 1: 100% Leder,,69.95,69.95
Bernie Mev ,Ballerinas aus elastischem Material - geflochten,Schwarz,36|37|38|39|40|41,"Damen Ballerinas von Bernie Mev|Elastisches, geflochtenes Material|Abgerundete Spitze|Kontrasteinsatz an der Ferse|Gummisohle|Sohlenhöhe: 1 cm|Farbe Schwarz|Artikelnummer 9710157",Hauptmaterial 1: 100% Textil|Futter 1: 100% Textil|Sohle: 100% Gummi,,79.95,79.95
Castañer,Wedges aus Canvas mit Schnürverschluss,Taupe|Schwarz,36|37|38|39|40|41,Damen Wedges von Castañer|Canvas|Abgerundete Spitze|Schnürverschluss|Fersenbereich in Kontrastfarbe|Keilabsatz mit Besatz in Flechtoptik|Gummisohle|Made in Spain|Absatzhöhe: 8 cm|Farbe Schwarz|Artikelnummer 9634786,Hauptmaterial 1: 100% Textil|Sohle: 100% Gummi,,125.95,125.95
Guess,Stiefelette in Denimoptik mit Peeptoe,Schwarz,36|37|38|39|40|41,"Damen Stiefelette von GUESS|Modell Pastoral|Denimoptik|Peeptoe|Fransenbesatz|Dekorative Schnürung an der Ferse|Seitlicher Reißverschluss |High Heels|Absatzhöhe: 10,5 cm|Farbe Schwarz|Artikelnummer 9630045",Hauptmaterial 1: 100% Textil|Sohle: 100% Gummi,,155.95,155.95
Gant,Sneaker mit Logo-Stickerei,Marineblau|Hellrosa|Sand|Weiß,36|37|38|39|40|41,"Damen Sneaker von GANT|Modell Zoe|Textil|Gummisohle|Abgerundete Spitze|Schnürverschluss|Logo-Stickerei|Sohlenhöhe: 2,5 cm|Farbe Marineblau|Artikelnummer 9609297",Hauptmaterial 1: 100% Textil|Futter 1: 100% Textil|Sohle: 100% Gummi,,59.95,59.95
Tommy Hilfiger,Wedges aus Canvas mit Lederdetails,Weiß|Hellrosa|Schwarz,36|37|38|39|40|41,Damen Wedges von Tommy Hilfiger |Canvas mit Details aus Leder|Abgerundete Spitze |Schleifenförmiger Riemen mit Logo-Stickerei|Riemenverschluss|Keilabsatz|Gummisohle mit Besatz in Flechtoptik|Absatzhöhe: 9 cm|Farbe Hellrosa|Artikelnummer 9591641,Hauptmaterial 1: 100% Textil|Hauptmaterial 2: 100% Leder|Sohle: 100% Gummi,,84.95,84.95
LACO'S,Loafer aus echtem Kalbsleder,Dunkelblau|Orange,"36|37|37,5|38|38,5|39|39,5|40|40,5|41|42",Damen Loafer von Laco's|Echtes Kalbsleder|Spitz zulaufende Form |Zierquasten|Ziernähte|Ledersohle|Blockabsatz|Innensohle aus echtem Leder|Made in Italy|Farbe Orange|Artikelnummer 9590185,Hauptmaterial 1: 100% Kalbsleder|Futter 1: 100% Leder|Sohle: 100% Leder,,229.0,119.95
Högl,Ballerinas aus Leder in Metallicoptik,Silber,"36|3,5|37|4|37,5|4,5|38|5|39|5,5|39,5|6|40|6,5|41|7|41,5|7,5|42|8",Damen Ballerinas von Högl|Echtes Leder in Metallicoptik|Spitz zulaufend|Fein strukturiert|Seitliche Aussparungen |Gummisohle|Sohlenhöhe: 1 cm|Wir empfehlen den Schuh eine 1/2 Nummer größer zu bestellen|Farbe Silber|Artikelnummer 9637340,Hauptmaterial 1: 100% Leder|Futter 1: 100% Leder|Sohle: 100% Gummi,,119.95,119.95
