Brandname,Productname,Colors,Sizes,Description,Materials,Maintenance,RegularPrice,CurrentPrice
Guess,Stiefeletten aus echtem Veloursleder,Dunkelblau|Cognac ,36|37|38|39|40|41,Damen Stiefeletten von Guess|Echtes Veloursleder|Spitz zulaufende Form|Überknöchelhoher Schaft|Reißverschluss|Pfennigabsatz mit Metall-Detail|Absatzhöhe: 10 cm|Farbe Dunkelblau|Artikelnummer 9507111,Hauptmaterial 1: 100% Leder|Futter 1: 100% Leder|Sohle: 100% Synthetik,,179.95,129.95
Tommy Hilfiger,Chelsea Boots aus Gummi,Schwarz|Marineblau,36|37|38|39|40|41,"Damen Chelsea Boots von Tommy Hilfiger|Gummi|Überknöchelhoher Schaft|Abgerundete Spitze|Seitliche, elastische Einsätze|Kontrastbesatz aus Leder mit Dornschließe|Profilsohle aus Gummi|Textiles Futter|Sohlenhöhe: 3 cm|Schafthöhe: 14 cm|Schaftweite: 28 cm|Farbe Schwarz|Artikelnummer 9671305",Hauptmaterial 1: 100% Synthetik|Futter 1: 100% Textil|Besatz 1: 100% Leder|Sohle: 100% Gummi, Nicht waschen| Nicht bleichen| Kein Trockner| Nicht bügeln| Keine chemische Reinigung,79.95,79.95
Glamorous,Pumps mit Schnürung,Schwarz,"35,5|3|37|4|38|5|39|6|41|7|42|8","Damen Pumps von Glamorous|Velourslederoptik|Vorne spitz zulaufend|Riemchen mit Schnürung|Absatz in Metallicoptik|Absatzhöhe: 9,5 cm|Farbe Schwarz|Artikelnummer 9643190",Hauptmaterial 1: 100% Textil|Sohle: 100% Gummi,,44.95,44.95
Colors of California,Gummistiefel mit Riegeln und Kontrastzipper,Schwarz|Dunkelblau|Schwarz|Dunkelbraun|Anthrazit,36|37|38|39|40|41,Damen Gummistiefel von Colors of California|Mattes Gummi|Abgerundete Spitze|Wadenhoher Schaft|Riegel mit Dornschließe|Nietenbesatz|Farblich abgesetzter Kontrastzipper |Textilfutter|Profilsohle aus Gummi|Sohlenhöhe: 3 cm|Farbe Dunkelblau|Artikelnummer 5513723,Hauptmaterial 1: 100% Gummi|Futter 1: 100% Textil|Sohle: 100% Gummi,,119.95,119.95
MARC CAIN BAGS & SHOES,Stiefelette aus Veloursleder mit Fransen,Sand|Schwarz,36|37|38|39|40|41,"Damen Stiefelette von Marc Cain Bags & Shoes|Veloursleder|Mittelhoher Schaft mit Fransen|Blockabsatz|Seitlicher Reißverschluss|Abgerundete Spitze|Gummisohle|Sohlenhöhe: 1,5 cm|Absatzhöhe: 10,5 cm|Farbe Sand|Artikelnummer 9492668",Hauptmaterial 1: 100% Leder|Sohle: 100% Gummi,,199.95,129.95
Vagabond,Chelsea Boots mit Blockabsatz,Sand,39|41,Damen Chelsea Boots von Vagabond|Veloursleder|Blockabsatz|Abgerundete Spitze|Überknöchelhoher Schaft|Elastische Einsätze|Absatzhöhe: 7 cm|Farbe Sand|Artikelnummer 9333693,Hauptmaterial 1: 100% Leder|Futter 1: 100% Leder|Futter 2: 100% Textil|Sohle: 100% Gummi,,109.95,79.95
P448,Sneaker aus Leder mit Kontrasteinsatz,Weiß|Silber,37|38|39|40|41|42,"Damen Sneaker von P448|Echtes Leder|Schimmernder Kontrasteinsatz in Schuppenoptik|Perforierte und strukturierte Details |Schnürverschluss|Reißverschluss an der Innenseite |Profilsohle aus Gummi|Sohlenhöhe: 2,5 cm|Farbe Silber|Artikelnummer 9624819",Hauptmaterial 1: 100% Leder|Sohle: 100% Gummi,,199.95,199.95
SunZ,Espadrilles mit Schnürung,Schwarz,37|41,Damen Espadrilles von SUNZ|Weiches Material|Schnürverschluss|Label-Patch|Sohle in naturbelassener Optik|Gummisohle|Handmade in Spain|Sohlenhöhe: 2 cm|Farbe Schwarz|Artikelnummer 9461198,,,99.95,59.95
Tommy Hilfiger,Pumps mit Rippenstruktur,Dunkelblau|Beige,36|37|38|39|40|41,Damen Pumps von Tommy Hilfiger |Textil|Feine Rippenstruktur|Abgerundete Spitze|Pfennigabsatz|Gummisohle|Absatzhöhe: 9 cm|Farbe Beige|Artikelnummer 9591633,Hauptmaterial 1: 100% Textil|Sohle: 100% Gummi,,99.95,99.95
Nike,Internationalist Sneaker mit Besatz aus Veloursleder,Rosa|Schwarz,"36|5,5|37,5|6,5|38|7|39|8|39,5|8,5|41|9,5","Damen Sneaker von NIKE|Modell Internationalist|Strapazierfähiges Material|Strukturiertes Muster|Besatz aus echtem Veloursleder|Schnürverschluss|Gummisohle|Sohlenhöhe: 2,5 cm|Farbe Rosa|Artikelnummer 9657053",Hauptmaterial 1: 100% Leder|Hauptmaterial 2: 100% Textil|Futter 1: 100% Textil|Sohle: 100% Gummi,,89.95,89.95
Buffalo,Stiefelette aus echtem Leder,Schwarz,36|37|38|39|40|41,Damen Stiefelette von Buffalo|Modell Mestico|Echtes Leder|Überknöchelhoher Schaft|Elastische Einsätze|Vorne Spitz zulaufend|Innensohle aus echtem Leder|Gummisohle|Absatz|Made in Europe|Absatzhöhe: 9 cm|Farbe Schwarz|Artikelnummer 9526204,Hauptmaterial 1: 100% Leder|Futter 1: 100% Leder|Sohle: 100% Gummi, Nicht waschen| Nicht bleichen| Kein Trockner| Nicht bügeln| Keine chemische Reinigung,129.95,99.95
Högl,Pumps aus Lackleder,Schwarz|Beige,"36|3,5|37|4|37,5|4,5|38|5|39|5,5|39,5|6|40|6,5|41|7|41,5|7,5|42|8",Damen Pumps von Högl|Echtes Lackleder|Abgerundete Spitze|Innensohle aus Leder|Pfennigabsatz|Absatzhöhe: 9 cm |Wir empfehlen den Schuh eine 1/2 Nummer größer zu bestellen |Farbe Beige|Artikelnummer 9637327,Hauptmaterial 1: 100% Leder|Futter 1: 100% Leder|Sohle: 100% Leder,,129.95,129.95
Pedro Miralles,Sandalette aus Veloursleder mit T-Riemen,Schwarz,36|37|38|39|40|42,"Damen Sandalette von Pedro Miralles|Echtes Veloursleder|T-Riemen|Reißverschluss im Fersenbereich|Blockabsatz|Gummisohle|Absatzhöhe: 5,5 cm|Farbe Schwarz|Artikelnummer 9636294",Hauptmaterial 1: 100% Veloursleder|Sohle: 100% Gummi,,159.95,159.95
Coolway,Stiefel aus Veloursleder ,Schwarz,36|37|38|39|40|41,Damen Stiefel von Coolway|Modell Bone|Echtes Veloursleder|Abgerundete Spitze |Profilsohle|Kleiner Blockabsatz|Futter aus Webpelz|Verstellbare Riemen|Regulierbare Schaftweite |Absatzhöhe: 4 cm|Schafthöhe: 26 cm |Farbe Schwarz|Artikelnummer 9535687,Hauptmaterial 1: 100% Veloursleder|Futter 1: 100% Synthetik|Sohle: 100% Gummi,,119.95,79.95
Converse,Sneakers aus Canvas,Marineblau,"36,5|37|37,5|38|39|41",Damen Sneakers von Converse|Canvas|Gummisohle|Abgerundete Spitze mit Vorderkappe|Überknöchelhoher Schaft|Schnürverschluss|Logoprint|Sohlenhöhe: 3 cm|Farbe Marineblau|Artikelnummer 9332962,Hauptmaterial 1: 100% Canvas|Futter 1: 100% Canvas|Sohle: 100% Gummi,,69.95,69.95
Guess,Slingback Wedges mit Spitze und Glitter-Effekt,Weiß|Koralle,36|37|38|39|40|41,Damen Slingback Wedges von Guess|Spitze mit Glitter-Effekt|Riemchenverschluss|Keilabsatz mit Besatz in Flechtoptik|Metall-Logo|Absatzhöhe: 12 cm|Farbe Koralle|Artikelnummer 9404537,"Hauptmaterial 1: 100% Textil|Futter 1: 50% Leder, 50% Textil|Sohle: 100% Synthetik",,135.95,79.95
Birkenstock,Sandalen mit Lammfellfutter,Schwarz,35|36,Damen Sandalen von Birkenstock|Modell Madrid Fell|Lederriemen|Lammfellfutter|Schmales Fußbett aus Naturkork|EVA-Sohle|Eine Dornschließe|Sohlenhöhe: 1 cm|Farbe Schwarz|Artikelnummer 9301550,Hauptmaterial 1: 100% Leder|Hauptmaterial 2: 100% Lammfell|Futter 1: 100% Lammfell|Sohle: 100% Gummi,,89.95,89.95
UGG,Slipper aus echtem Lammfell,Mittelgrau|Beige,36|5|37|6|38|7|39|8|40|9|41|10,Damen Slipper von UGG Australia|Modell Birche|Echtes Lammfell|Logo-Aufnäher aus echtem Leder|Elastischer Bund|Innensohle aus reiner Wolle|Ledersohle|Sohlenhöhe: 1 cm|Farbe Mittelgrau|Artikelnummer 9522641,"Hauptmaterial 1: 100% Lammfell|Futter 1: 100% Textil, 100% Wolle|Sohle: 100% Leder",,89.95,89.95
ALPE,Stiefelette aus Veloursleder mit Riegel,Mittelbraun,36|37|38|39|40|41,"Damen Stiefelette von Alpe |Echtes Veloursleder|Abgerundete Spitze |Verstellbarer Riegel am Schaft|Absatz|Überknöchelhoher Schaft|Details mit Webpelzbesatz|Absatzhöhe: 9,5 cm |Sohlenhöhe: 2 cm |Farbe Mittelbraun|Artikelnummer 9567753",Hauptmaterial 1: 100% Veloursleder|Sohle: 100% Gummi,,99.95,79.95
Tamaris,Stiefel mit Blockabsatz,Cognac ,36|37|38|39|40|41,Damen Stiefel von Tamaris|Echtes Glattleder|Abgerundete Spitze |Elastischer Einsatz am Schaft|Reißverschlüsse |Blockabsatz|Absatzhöhe: 8 cm|Schafthöhe: 38 cm|Schaftweite: 34 cm|Farbe Cognac |Artikelnummer 9540176,Hauptmaterial 1: 100% Leder|Sohle: 100% Gummi,,119.95,89.95
Selected Femme,High Top Sneaker aus echtem Veloursleder,Mittelgrau,36|37|38|39|40|41,Damen High Top Sneaker von SELECTED FEMME|Modell Alba|Echtes Veloursleder|Überknöchelhoher Schaft|Ziernähte|Schnürverschluss|Innensohle aus echtem Leder|Plateausohle aus Gummi|Sohlenhöhe: 4 cm|Farbe Mittelgrau|Artikelnummer 9632660,Hauptmaterial 1: 100% Leder|Futter 1: 100% Leder|Sohle: 100% Gummi,,129.95,129.95
Tamaris,Stiefelette mit gemustertem Blockabsatz,Mittelgrau,36|37|38|39|40|41,"Damen Stiefelette von Tamaris|Textil|Eckige Spitze mit abgerundeten Kanten |Gemusterter Blockabsatz in Lackoptik|Seitliche Reißverschlüsse|Dekorative Teilungsnähte |Überknöchelhoher Schaft|Absatzhöhe: 7,5 cm |Farbe Mittelgrau|Artikelnummer 9541441",Hauptmaterial 1: 100% Textil|Sohle: 100% Gummi,,59.95,44.95
UGG,Booties aus Leder mit Futter aus Lammfell,Taupe|Schwarz,36|5|37|6|38|7|39|8|40|9|41|10,"Damen Booties von Ugg Australia|Modell W Lavelle|Echtes Leder|Abgerundete Spitze |Kleiner Absatz|Sohle aus Gummi|Kurze, seitliche Reißverschlüsse|Futter aus Lammfell|Überknöchelhoher Schaft|Absatzhöhe: 3 cm |Farbe Taupe|Artikelnummer 9522645",Hauptmaterial 1: 100% Leder|Futter 1: 100% Lammfell|Sohle: 100% Gummi,,179.95,179.95
Colors of California,Gummistiefel mit regulierbaren Riemen,Schwarz|Dunkelgrau|Taupe|Royalblau,36|37|38|39|40|41,"Damen Gummistiefel von Colors of California|Mattes Gummi|Wadenhoher Schaft|Kurzer Reißverschluss auf der Rückseite|Regulierbare Riemen|Abgerundete Spitze|Plateausohle|Profilsohle aus Gummi|Sohlenhöhe: 3,5 cm|Schafthöhe: 18 cm|Schaftweite: 13 cm|Farbe Schwarz|Artikelnummer 9534150",Hauptmaterial 1: 100% Gummi|Futter 1: 100% Textil|Sohle: 100% Gummi, Nicht waschen| Nicht bleichen| Kein Trockner| Nicht bügeln| Keine chemische Reinigung,129.95,89.95
APOLLO,Hausschuhe mit Weihnachts-Applikation,Rot|Grün|Schwarz,37/39|40/42,"Damen Hausschuhe von Apollo|Nicki|Teddyfutter|Anti-Rutsch-Sohle|Abgerundete Spitze|Slip-On|Weihnachts-Applikation|Sohlenhöhe: 0,2 cm|Farbe Rot|Artikelnummer 9642130",Hauptmaterial 1: 100% Textil|Futter 1: 100% Textil|Sohle: 100% Textil, Normalwaschgang 30°| Nicht bleichen| Kein Trockner| Nicht bügeln| Keine chemische Reinigung,14.95,9.95
Colors of California,Gummistiefel mit regulierbaren Riemen,Schwarz|Dunkelgrau|Taupe|Royalblau,36|37|38|39|40|41,"Damen Gummistiefel von Colors of California|Mattes Gummi|Wadenhoher Schaft|Kurzer Reißverschluss auf der Rückseite|Regulierbare Riemen|Abgerundete Spitze|Plateausohle|Profilsohle aus Gummi|Sohlenhöhe: 3,5 cm|Schafthöhe: 18 cm|Schaftweite: 13 cm|Farbe Dunkelgrau|Artikelnummer 9534151",Hauptmaterial 1: 100% Gummi|Futter 1: 100% Textil|Sohle: 100% Gummi, Nicht waschen| Nicht bleichen| Kein Trockner| Nicht bügeln| Keine chemische Reinigung,129.95,69.95
MARC CAIN BAGS & SHOES,Booties aus echtem Leder,Graphit,37|38|39|40,Damen Booties von Marc Cain Bags & Shoes|Echtes Leder|Metallicoptik|Riegel mit Dornschließe|Kontrasteinsatz in Kroko-Optik|Überknöchelhoher Schaft mit Umschlag|Futter aus echtem Fell|Gummisohle|Sohlenhöhe: 3 cm|Farbe Graphit|Artikelnummer 9492676,Hauptmaterial 1: 100% Leder|Futter 1: 100% Leder|Sohle: 100% Gummi,,399.0,199.95
Coolway,Boots aus Leder in Wickeloptik,Schwarz|Dunkelbraun,36|37|38|39|40|41,"Damen Boots von Coolway|Modell Alida|Echtes Leder|Vintage Look|Asymmetrischer, wadenhoher Schaft in Wickeloptik|Regulierbare Riegel am Schaft|Seitlicher Reißverschluss|Abgerundete Spitze|Doppelte Sohle|Profilsohle aus Gummi|Logo-Prägung am Schaft|Sohlenhöhe: 1,5 cm|Absatzhöhe: 4 cm|Schafthöhe: 29 cm|Farbe Dunkelbraun|Artikelnummer 9535686",Hauptmaterial 1: 100% Leder|Sohle: 100% Gummi, Nicht waschen| Nicht bleichen| Kein Trockner| Nicht bügeln| Keine chemische Reinigung,99.95,99.95
Coolway,Boots aus Leder in Wickeloptik,Schwarz|Dunkelbraun,36|37|38|39|40|41,"Damen Boots von Coolway|Modell Alida|Echtes Leder|Vintage Look|Asymmetrischer, wadenhoher Schaft in Wickeloptik|Regulierbare Riegel am Schaft|Seitlicher Reißverschluss|Abgerundete Spitze|Doppelte Sohle|Profilsohle aus Gummi|Logo-Prägung am Schaft|Sohlenhöhe: 1,5 cm|Absatzhöhe: 4 cm|Schafthöhe: 29 cm|Farbe Dunkelbraun|Artikelnummer 9535686",Hauptmaterial 1: 100% Leder|Sohle: 100% Gummi, Nicht waschen| Nicht bleichen| Kein Trockner| Nicht bügeln| Keine chemische Reinigung,99.95,99.95
Converse,Chucks aus Canvas,Schwarz,"36|36,5",Damen Chucks von Converse|Modell All Star Ox|Canvas|Gummisohle|Vorderkappe|Schnürverschluss|Sohlenhöhe: 3 cm|Farbe Schwarz|Artikelnummer 9256736,Hauptmaterial 1: 100% Canvas|Futter 1: 100% Textil|Sohle: 100% Gummi,,64.95,64.95
Armani Jeans,High Top Sneaker aus Leder mit Glitter-Effekt,Gold|Silber,36|37|38|39|40|41,Damen High Top Sneaker von Armani Jeans|Echtes Leder mit Textilbesatz und Glitter-Effekt|Abgerundete Spitze|Schnürverschluss|Überknöchelhoher Schaft|Seitlicher Reißverschluss|Logo-Applikation|Profilsohle aus Gummi|Sohlenhöhe: 2 cm|Farbe Gold|Artikelnummer 9571352,Hauptmaterial 1: 100% Leder|Hauptmaterial 2: 100% Textil|Sohle: 100% Gummi,,189.95,189.95
Soccx,Sneaker aus Leder mit Kontrasteinsätzen,Rosé|Weiß,36|37|38|39|40|41,"Damen Sneaker von SOCCX|Echtes Leder|Strukturierte Kontrasteinsätze|Textilbesatz|Abgerundete Spitze|Schnürverschluss|Logo-Applikationen|Profilsohle aus Gummi|Sohlenhöhe: 2,5 cm|Farbe Rosé|Artikelnummer 9614854",Hauptmaterial 1: 100% Leder|Hauptmaterial 2: 100% Synthetik|Hauptmaterial 3: 100% Textil|Sohle: 100% Gummi,,69.95,69.95
UGG,Booties aus Veloursleder mit Futter aus Lammfell,Mittelbraun,36|5|37|6|38|7|39|8|40|9|41|10,"Damen Booties von Ugg Australia|Modell W Quincy|Echtes Veloursleder |Abgerundete Spitze |Futter aus Lammfell|Überknöchelhoher Schaft|Schnürverschluss|Logo-Prägung an der Ferse|Sohlenhöhe: 2,5 cm|Farbe Mittelbraun|Artikelnummer 9522644",Hauptmaterial 1: 100% Veloursleder|Futter 1: 100% Lammfell|Sohle: 100% Gummi,,209.0,209.0
Marc O'Polo,Sneaker aus Veloursleder mit Logo-Stickereien,Bleu|Schlamm,36|37|38|39|40|41,Damen Sneaker von MARC O'POLO|Echtes Veloursleder mit Besatz aus Textil|Schnürverschluss|Logo-Stickereien|Profilsohle aus Gummi|Sohlenhöhe: 2 cm|Farbe Bleu|Artikelnummer 9606552,Hauptmaterial 1: 100% Veloursleder|Hauptmaterial 2: 100% Nylon,,109.95,109.95
UGG,Stiefelette aus Leder mit Lammfell,Schwarz,36|5|37|6|38|7|39|8|40|9|41|10,"Damen Stiefelette von UGG Australia|Modell Ingrid|Echtes Leder |Futter aus Lammfell und Leder|Abgerundete Spitze |Überknöchelhoher Schaft|Schnürverschluss und seitlicher Reißverschluss|Verstellbarer Riemen|Blockabsatz|Absatzhöhe: 6 cm|Sohlenhöhe: 1,5 cm|Farbe Schwarz|Artikelnummer 9522643","Hauptmaterial 1: 100% Leder|Futter 1: 50% Lammfell, 50% Leder|Sohle: 100% Synthetik",,299.0,199.95
Marc O'Polo,Sneaker aus Leder in Metallicoptik,Silber,36|37|38|39|40|41,Damen Sneaker von MARC O'POLO|Echtes Leder|Metallicoptik|Kontrastbesatz aus Veloursleder|Logo-Stickerei|Schnürverschluss|Innensohle aus Leder|Gummisohle|Sohlenhöhe: 2 cm|Farbe Silber|Artikelnummer 9606556,Hauptmaterial 1: 100% Leder|Futter 1: 100% Textil|Futter 2: 100% Leder|Sohle: 100% Gummi,,99.95,99.95
Reebok,High Top Sneaker mit Print,Weiß,"37,5|7|40|9",Damen High Top Sneaker von Reebok|Leder|Gummisohle|Abgerundete Spitze|Überknöchelhoher Schaft|Schnürverschluss|Klettverschluss|Print|Sohlenhöhe: 3 cm|Farbe Weiß|Artikelnummer 9423901,Hauptmaterial 1: 100% Leder|Hauptmaterial 2: 100% Kunststoff|Futter 1: 100% Textil|Sohle: 100% Gummi,,89.95,89.95
Buffalo,Sandaletten aus Leder in Metallicoptik,Gold,36|37|38|39|40|41,"Damen Sandaletten von Buffalo|Echtes Leder in Metallicoptik|Riemchen mit Dornschließe |Blockabsatz|Absatzhöhe: 5,5 cm|Farbe Gold|Artikelnummer 9624741",Hauptmaterial 1: 100% Leder|Futter 1: 100% Leder|Sohle: 100% Gummi,,79.95,79.95
Marc O'Polo,Sandalen aus echtem Leder,Cognac ,36|37|38|39|40|41,"Damen Sandalen von Marc O'Polo|Echtes Leder|Blockabsatz|Platausohle|Gummisohle|Abgerundete Spitze|Kontrastnaht|Nieten|Plateauhöhe: 3,5 cm|Absatzhöhe: 11 cm|Farbe Cognac |Artikelnummer 9434106",Hauptmaterial 1: 100% Leder|Futter 1: 100% Textil|Futter 2: 100% Leder|Sohle: 100% Gummi,,149.95,99.95
Buffalo,Stiefelette aus Veloursleder mit Zierriemen ,Schwarz,36|37|38|39|40|41,"Damen Stiefelette von Buffalo|Echtes Veloursleder|Abgerundete Spitze|Zierriemen mit Zierquasten|Dekorative Teilungsnähte |Absatz|Überknöchelhoher Schaft|Absatzhöhe: 9,5 cm|Schafthöhe: 16 cm |Farbe Schwarz|Artikelnummer 9526208",Hauptmaterial 1: 100% Leder|Sohle: 100% Gummi,,129.95,99.95
Marc O'Polo,Sneaker mit Streifenmuster,Marineblau,36|37|38|39|40|41,Damen Sneaker von MARC O'POLO|Textil|Strukturierte Oberfläche|Abgerundete Spitze|Schnürverschluss|Teilungsnähte|Logo-Details|Kontrastfarbene Gummisohle|Streifenmuster|Sohlenhöhe: 3 cm|Farbe Marineblau|Artikelnummer 9606558,Hauptmaterial 1: 100% Textil|Futter 1: 100% Textil|Sohle: 100% Synthetik,,59.95,59.95
APOLLO,Hausschuhe mit Weihnachts-Applikation,Rot|Grün|Schwarz,37/39|40/42,"Damen Hausschuhe von Apollo|Nicki|Teddyfutter|Anti-Rutsch-Sohle|Abgerundete Spitze|Slip-On|Weihnachts-Applikation|Sohlenhöhe: 0,2 cm|Farbe Schwarz|Artikelnummer 9642132",Hauptmaterial 1: 100% Textil|Futter 1: 100% Textil|Sohle: 100% Textil, Normalwaschgang 30°| Nicht bleichen| Kein Trockner| Nicht bügeln| Keine chemische Reinigung,14.95,9.95
MICHAEL Michael Kors,Sandalette aus Veloursleder mit Stilettoabsatz,Schwarz,"37|7|38,5|8|39|8,5|40|9|40,5|9,5|41|10",Damen Sandalette von MICHAEL Michael Kors|Modell Honey Sandal|Echtes Veloursleder|Stilettoabsatz|Zierriemen|Aussparungen mit eingesetzten Ziersteinen|Absatzhöhe: 11 cm|Farbe Schwarz|Artikelnummer 9582364,Hauptmaterial 1: 100% Veloursleder,,175.95,175.95
Guess,Stiefelette aus Leder mit Schnürverschluss,Schwarz,36|37|38|39|40|41,Damen Stiefelette von GUESS|Echtes Leder|Überknöchelhoher Schaft|Steppmuster am Schaft|Schnürverschluss|Seitlicher Nahtreißverschluss|Spitz zulaufende Form|Plateausohle mit Profil|Blockabsatz|Sohlenhöhe: 3 cm|Absatzhöhe: 12 cm|Farbe Schwarz|Artikelnummer 9522663,Hauptmaterial 1: 100% Leder|Futter 1: 100% Leder|Sohle: 100% Gummi, Nicht waschen| Nicht bleichen| Kein Trockner| Nicht bügeln| Keine chemische Reinigung,195.95,149.95
DKNY,Slip-On Sneaker aus echtem Glattleder,Rot,"36|6|37|6,5|37,5|7|38|7,5|38,5|8|39|8,5|40|9|40,5|9,5|41|10","Damen Slip-On Sneaker von DKNY|Modell Kara|Echtes Glattleder|Elastische Einsätze|Innensohle aus echtem Leder|Detail in Holzoptik|Plateausohle aus Gummi|Sohlenhöhe: 3,5 cm|Farbe Rot|Artikelnummer 9533414",Hauptmaterial 1: 100% Leder|Futter 1: 100% Leder|Einsatz: 100% Textil,,279.0,149.95
Kennel & Schmenger,Sneaker aus Veloursleder mit Klettverschlüssen,Taupe,"37|4|37,5|4,5|38|5|38,5|5,5|39|6|40|6,5|40,5|7|41|7,5|42|8",Damen Sneaker von Kennel & Schmenger|Modell Town|Echtes Veloursleder|Abgerundete Spitze |Klettverschlüsse|Besatz aus feinen Fransen|Gummisohle|Logo-Applikation an der Sohle|Sohlenhöhe: 2 cm|Farbe Taupe|Artikelnummer 9611254,Hauptmaterial 1: 100% Veloursleder,,199.95,199.95
Timberland,Chelsea Boots aus echtem Leder,Dunkelbraun,"37|6|37,5|6,5|38|7|38,5|7,5|39|8|39,5|8,5|40|9|41|9,5|41,5|10","Damen Chelsea Boots von Timberland|Echtes Leder|Knöchelhoher Schaft|Elastische Einsätze|Breite Gummisohle|Sohlenhöhe: 2,5 cm|Farbe Dunkelbraun|Artikelnummer 9491212",Hauptmaterial 1: 100% Leder|Futter 1: 100% Textil|Einsatz: 100% Textil|Sohle: 100% Gummi,,129.95,129.95
Kennel & Schmenger,Sandalen aus Veloursleder,Hellgrau,"37|4|37,5|4,5|38|5|38,5|5,5|39|6|40|6,5|40,5|7|41|7,5|42|8","Damen Sandalen von Kennel & Schmenger|Veloursleder|Abgerundete Spitze|Plateausohle|Sohle aus Gummi|Riemen mit Zierschleife|Sohlenhöhe: 3,5 cm|Farbe Hellgrau|Artikelnummer 9611259",Hauptmaterial 1: 100% Leder|Futter 1: 100% Leder|Sohle: 100% Gummi, Nicht waschen| Nicht bleichen| Kein Trockner| Nicht bügeln| Keine chemische Reinigung,189.95,189.95
Superga,Plateau-Sneaker aus Canvas,Weiß,36|37|38|39|40|41|42,"Damen Plateau-Sneaker von Superga|Canvas|Abgerundete Spitze|Schnürverschluss|Plateausohle aus Gummi mit Kontrastbesatz in Flechtoptik|Sohlenhöhe: 4,5 cm|Farbe Weiß|Artikelnummer 9613092",Hauptmaterial 1: 100% Baumwolle|Futter 1: 100% Baumwolle|Sohle: 100% Gummi,,89.95,89.95
Converse,Chucks mit Logoprint,Bordeaux Rot,"36|36,5|37|37,5|38|39|39,5",Damen Chucks von Converse|Modell All Star Hi|Canvas|Gummisohle|Halbhoher Schaft|Vorderkappe|Schnürverschluss|Logoprint|Sohlenhöhe: 3 cm|Farbe Bordeaux Rot|Artikelnummer 9256730,Hauptmaterial 1: 100% Textil|Futter 1: 100% Textil|Sohle: 100% Gummi,,69.95,69.95
s.Oliver RED LABEL,Stiefelette aus echtem Veloursleder,Beige,36|37|38|39|40|41|42,Damen Stiefelette von s.Oliver Premium|Echtes Veloursleder|Kontrastbesätze in Schlangenlederoptik|Elastische Einsätze|Profilsohle aus Gummi|Absatz|Absatzhöhe: 8 cm|Farbe Beige|Artikelnummer 9540208,Hauptmaterial 1: 100% Leder|Futter 1: 100% Textil|Einsatz: 100% Textil|Sohle: 100% Gummi,,79.95,49.95
Pedro Miralles,Stiefelette mit Keilabsatz,Schwarz,36|37|38|39|40|41|42,"Damen Stiefelette von Pedro Miralles|Velourslederoptik|Überknöchelhoher, leicht elastischer Schaft|Ziernähte|Keilabsatz|Profilsohle aus Gummi|Innensohle aus echtem Leder|Sohlenhöhe: 2,5 cm|Absatzhöhe: 8,5 cm|Farbe Schwarz|Artikelnummer 9533429",Hauptmaterial 1: 100% Textil|Futter 1: 100% Leder|Sohle: 100% Gummi,,139.95,99.95
Puma,Sneaker aus Veloursleder - Puma Platform  Ex ,Schwarz,"37|4|37,5|4,5|38|5|38,5|5,5|39|6|40|6,5|40,5|7",Damen Sneaker von PUMA|Modell Suede Platform Explos|Echtes Veloursleder|Logo-Streifen und Besatz in Metallicoptik|Schnürverschluss|Plateausohle aus Gummi|Sohlenhöhe: 3 cm|Farbe Schwarz|Artikelnummer 9601190,Hauptmaterial 1: 100% Leder|Futter 1: 100% Textil|Sohle: 100% Gummi,,109.95,109.95
Tamaris,Tassel Loafer mit Metallic-Details ,Rosa,36|37|38|39|40|41|42,Damen Tassel Loafer von Tamaris|Echtes Leder|Abgerundete Spitze|Metallic-Details in Krokodillederoptik|Shoe Flaps|Zierquasten|Perforierte Details|Gummisohle|Sohlenhöhe: 2 cm |Farbe Rosa|Artikelnummer 9634208,Hauptmaterial 1: 100% Leder|Sohle: 100% Gummi,,69.95,69.95
Clarks,Budapester aus Lackleder,Schwarz,"37,5|4,5|38|5|39|5,5|39,5|6|40|6,5|41|7|42|8",Damen Budapester von Clarks|Modell Hamble Oak|Echtes Lackleder|Gummisohle|Abgerundete Spitze|Geschlossene Schnürung|Flügelkappe|Lyralochung|Sohlenhöhe: 3 cm|Farbe Schwarz|Artikelnummer 5492886,Hauptmaterial 1: 100% Leder|Futter 1: 100% Textil|Futter 2: 100% Leder|Sohle: 100% Gummi,,99.95,99.95
Tamaris,Ankle Boots aus echtem Leder,Hellgrau,36|37|38|39|40|41|42,"Damen Ankle Boots von Tamaris|Echtes Leder|Überknöchelhoher Schaft|Seitlicher Reißverschluss|Ferse in Schlangenlederoptik|Schmal zulaufender Absatz|Profilsohle aus Gummi|Sohlenhöhe: 2 cm|Absatzhöhe: 8,5 cm|Farbe Hellgrau|Artikelnummer 9540165",Hauptmaterial 1: 100% Leder|Futter 1: 100% Leder|Sohle: 100% Gummi, Nicht waschen| Nicht bleichen| Kein Trockner| Nicht bügeln| Keine chemische Reinigung,79.95,59.95
Buffalo,Stiefelette aus echtem Glattleder,Schwarz,36|37|38|39|40|41|42,Damen Stiefelette von Buffalo|Modell Garda|Echtes Glattleder|Überknöchelhoher Schaft|Seitlicher Reißverschluss|Keilabsatz aus Gummi|Absatzhöhe: 10 cm|Farbe Schwarz|Artikelnummer 9526210,Hauptmaterial 1: 100% Leder|Futter 1: 100% Textil|Absatz: 100% Gummi,,99.95,74.95
Marc O'Polo,Sneaker aus Canvas,Weiß,36|37|38|39|40|41|42,Damen Sneaker von MARC O'POLO|Canvas|Ziernähte|Schnürverschluss|Logo-Fähnchen|Gummisohle|Sohlenhöhe: 3 cm|Farbe Weiß|Artikelnummer 9606557,Hauptmaterial 1: 100% Textil|Futter 1: 100% Textil|Sohle: 100% Gummi,,59.95,59.95
Tamaris,Sandaletten aus echtem Veloursleder mit Fransen,Mittelbraun,36|37|38|39|40|41|42,"Damen Sandaletten von Tamaris|Echtes Veloursleder|Knöchelhoher Schaft|Fransen|Nietenbesatz|Geschlossene Ferse|Reißverschluss|T-Riemen|Pfennigabsatz|Absatzhöhe: 7,5 cm|Farbe Mittelbraun|Artikelnummer 9450918","Hauptmaterial 1: 100% Leder|Futter 1: 50% Leder, 50% Synthetik|Sohle: 100% Synthetik",,69.95,39.95
Progetto ,Stiefelette aus echtem Veloursleder,Dunkelbraun,36|37|38|39|40|41|42,Damen Stiefelette von Progetto|Echtes Veloursleder|Überknöchelhoher Schaft|Zierriegel aus echtem Glattleder|Seitlicher Reißverschluss|Absatz|Gummisohle|Farbe Dunkelbraun|Artikelnummer 9569287,Hauptmaterial 1: 100% Leder,,139.95,99.95
MICHAEL Michael Kors,Sneaker mit Zehenkappe in Metallicoptik,Mittelgrau,"37|7|38|7,5|38,5|8|39|8,5|40|9|40,5|9,5|41|10","Damen Sneaker von MICHAEL Michael Kors|Modell Frankie|Strapazierfähiges Material |Abgerundete Spitze |Schnürverschluss|Zehenkappe in Metallicoptik|Logo-Applikationen|Florales Muster|Gummisohle|Sohlenhöhe: 2,5 cm|echtes Leder|Farbe Mittelgrau|Artikelnummer 9582376",Hauptmaterial 1: 100% Rindsnappa|Sohle: 100% Gummi,,149.95,149.95
SOREL,Boots mit Teddyfutter - wasserdicht,Schwarz|Beige,"37|6|37,5|6,5|38|7|38,5|7,5|39|8|39,5|8,5|40|9|40,5|9,5|41|10|41,5|10,5|42|11|43|12","Damen Boots von Sorel|Modell Cozy™ Carnival|Strapazierfähiges, wasserdichtes Material|Teddyfutter|Kontrastfarbene Profilsohle aus Gummi|Abgerundete Spitze|Überknöchelhoher Schaft|Schnürverschluss|Kontrastbesatz|Logo- & Kontrastdetails|Sohlenhöhe: 3 cm |Farbe Beige|Artikelnummer 9507122",Hauptmaterial 1: 100% Textil|Futter 1: 100% Textil|Sohle: 100% Gummi,,129.95,99.95
MICHAEL Michael Kors,Stiefelette aus Veloursleder im Patchwork-Stil,Dunkelbraun,"37|7|38|7,5|38,5|8|39|8,5|40|9|40,5|9,5|41|10","Damen Stiefelette von MICHAEL Michael Kors|Modell Rosamond|Echtes Veloursleder|Abgerundete Spitze|Pfennigabsatz|Reißverschluss an der Rückseite |Kontrasteinsatz im Patchwork-Stil |Details in Goldoptik|Überknöchelhoher Schaft|Absatzhöhe: 10,5 cm|Farbe Dunkelbraun|Artikelnummer 9514639",Hauptmaterial 1: 100% Veloursleder|Sohle: 100% Gummi,,275.0,199.95
Timberland,Booties aus echtem Veloursleder,Olivgrün,"37|6|37,5|6,5|38|7|38,5|7,5|39|8|39,5|8,5|40|9|41|9,5|41,5|10|42|11",Damen Booties von Timberland|Echtes Veloursleder|Überknöchelhoher Schaft|Elastische Einsätze|Profilsohle aus Gummi|Sohlenhöhe: 3 cm|Farbe Olivgrün|Artikelnummer 9491213,Hauptmaterial 1: 100% Leder|Futter 1: 100% Textil|Sohle: 100% Gummi,,149.95,119.95
